{
  "archivedAt": "2026-10-23T12:13:00.000462Z",
  "bundles": [
    {
      "asset": {
        "browser_download_url": "https://github.com/openwatersio/noaa-water-level-research/releases/download/receipts-20261023T121213Z-7e9f2dc9dc784ba49de1171bfa98b5b7/bundle-36a7f6f44b08f78a60bf3124c60265e61a23609ca9cff6763837ab2fa959879a.tar.gz",
        "id": 669020756,
        "name": "bundle-36a7f6f44b08f78a60bf3124c60265e61a23609ca9cff6763837ab2fa959879a.tar.gz",
        "size": 9553,
        "state": "uploaded"
      },
      "encoding": "tar+gzip",
      "sha256": "36a7f6f44b08f78a60bf3124c60265e61a23609ca9cff6763837ab2fa959879a"
    },
    {
      "asset": {
        "browser_download_url": "https://github.com/openwatersio/noaa-water-level-research/releases/download/receipts-20261023T121213Z-7e9f2dc9dc784ba49de1171bfa98b5b7/bundle-054030265ac2c92ea02fd833ccfbd244e1b3eeefc245a9a1b5e4674c4003c1d1.tar.gz",
        "id": 669020876,
        "name": "bundle-054030265ac2c92ea02fd833ccfbd244e1b3eeefc245a9a1b5e4674c4003c1d1.tar.gz",
        "size": 10167,
        "state": "uploaded"
      },
      "encoding": "tar+gzip",
      "sha256": "054030265ac2c92ea02fd833ccfbd244e1b3eeefc245a9a1b5e4674c4003c1d1"
    },
    {
      "asset": {
        "browser_download_url": "https://github.com/openwatersio/noaa-water-level-research/releases/download/receipts-20261023T121213Z-7e9f2dc9dc784ba49de1171bfa98b5b7/bundle-455805e42a787d33b70ee6f5a38a6757c2c7b53f787fdb580001f35ad433f6f1.tar.gz",
        "id": 669020997,
        "name": "bundle-455805e42a787d33b70ee6f5a38a6757c2c7b53f787fdb580001f35ad433f6f1.tar.gz",
        "size": 10184,
        "state": "uploaded"
      },
      "encoding": "tar+gzip",
      "sha256": "455805e42a787d33b70ee6f5a38a6757c2c7b53f787fdb580001f35ad433f6f1"
    },
    {
      "asset": {
        "browser_download_url": "https://github.com/openwatersio/noaa-water-level-research/releases/download/receipts-20261023T121213Z-7e9f2dc9dc784ba49de1171bfa98b5b7/bundle-568e7d328bfc97326c11c3d7e40bd0827d6b4f095d6cfcbbd7df0a2847684d2d.tar.gz",
        "id": 669021138,
        "name": "bundle-568e7d328bfc97326c11c3d7e40bd0827d6b4f095d6cfcbbd7df0a2847684d2d.tar.gz",
        "size": 1886,
        "state": "uploaded"
      },
      "encoding": "tar+gzip",
      "sha256": "568e7d328bfc97326c11c3d7e40bd0827d6b4f095d6cfcbbd7df0a2847684d2d"
    },
    {
      "asset": {
        "browser_download_url": "https://github.com/openwatersio/noaa-water-level-research/releases/download/receipts-20261023T121213Z-7e9f2dc9dc784ba49de1171bfa98b5b7/bundle-3378fb960f41370b374dfbe697eb11601379349a0b671eff60398fb89a959de5.tar.gz",
        "id": 669021273,
        "name": "bundle-3378fb960f41370b374dfbe697eb11601379349a0b671eff60398fb89a959de5.tar.gz",
        "size": 943,
        "state": "uploaded"
      },
      "encoding": "tar+gzip",
      "sha256": "3378fb960f41370b374dfbe697eb11601379349a0b671eff60398fb89a959de5"
    },
    {
      "asset": {
        "browser_download_url": "https://github.com/openwatersio/noaa-water-level-research/releases/download/receipts-20261023T121213Z-7e9f2dc9dc784ba49de1171bfa98b5b7/bundle-2ccf192de68a158fd7ecd9cb47af767da8d84acd9551db1d95e8ad753963ec77.tar.gz",
        "id": 669021379,
        "name": "bundle-2ccf192de68a158fd7ecd9cb47af767da8d84acd9551db1d95e8ad753963ec77.tar.gz",
        "size": 128752,
        "state": "uploaded"
      },
      "encoding": "tar+gzip",
      "sha256": "2ccf192de68a158fd7ecd9cb47af767da8d84acd9551db1d95e8ad753963ec77"
    },
    {
      "asset": {
        "browser_download_url": "https://github.com/openwatersio/noaa-water-level-research/releases/download/receipts-20261023T121213Z-7e9f2dc9dc784ba49de1171bfa98b5b7/bundle-577d1a54cf41e27a2463fe269375801859d7d2749cb3ede23f37a3727f51b979.tar.gz",
        "id": 669021504,
        "name": "bundle-577d1a54cf41e27a2463fe269375801859d7d2749cb3ede23f37a3727f51b979.tar.gz",
        "size": 8301763,
        "state": "uploaded"
      },
      "encoding": "tar+gzip",
      "sha256": "577d1a54cf41e27a2463fe269375801859d7d2749cb3ede23f37a3727f51b979"
    },
    {
      "asset": {
        "browser_download_url": "https://github.com/openwatersio/noaa-water-level-research/releases/download/receipts-20261023T121213Z-7e9f2dc9dc784ba49de1171bfa98b5b7/bundle-bb03261484559e947644ea505713caede84eda4327fd4810ac6f666f92d86e70.tar.gz",
        "id": 669021720,
        "name": "bundle-bb03261484559e947644ea505713caede84eda4327fd4810ac6f666f92d86e70.tar.gz",
        "size": 6814,
        "state": "uploaded"
      },
      "encoding": "tar+gzip",
      "sha256": "bb03261484559e947644ea505713caede84eda4327fd4810ac6f666f92d86e70"
    },
    {
      "asset": {
        "browser_download_url": "https://github.com/openwatersio/noaa-water-level-research/releases/download/receipts-20261023T121213Z-7e9f2dc9dc784ba49de1171bfa98b5b7/bundle-dd9a09c0344ad401f1b81324d71452520b6188c317c8a38f0c7cb795ad02f691.tar.gz",
        "id": 669021913,
        "name": "bundle-dd9a09c0344ad401f1b81324d71452520b6188c317c8a38f0c7cb795ad02f691.tar.gz",
        "size": 1010,
        "state": "uploaded"
      },
      "encoding": "tar+gzip",
      "sha256": "dd9a09c0344ad401f1b81324d71452520b6188c317c8a38f0c7cb795ad02f691"
    },
    {
      "asset": {
        "browser_download_url": "https://github.com/openwatersio/noaa-water-level-research/releases/download/receipts-20261023T121213Z-7e9f2dc9dc784ba49de1171bfa98b5b7/bundle-3444ed1cff30298d767c3ecdc87b1a33bbdd455f77d46545dc51ac9ac4dc1af0.tar.gz",
        "id": 669022044,
        "name": "bundle-3444ed1cff30298d767c3ecdc87b1a33bbdd455f77d46545dc51ac9ac4dc1af0.tar.gz",
        "size": 6836,
        "state": "uploaded"
      },
      "encoding": "tar+gzip",
      "sha256": "3444ed1cff30298d767c3ecdc87b1a33bbdd455f77d46545dc51ac9ac4dc1af0"
    }
  ],
  "completion": "complete",
  "context": {
    "batchId": "20261023T121213Z-7e9f2dc9dc784ba49de1171bfa98b5b7",
    "codeCommit": "2ae80775f6a630b1adf5706795dc607ffd16a443",
    "createdAt": "2026-10-23T12:12:13.581547Z",
    "event": "schedule",
    "origin": "github",
    "python": "3.12.15 (main, Oct  1 2026, 02:35:59) [GCC 13.3.0]",
    "runAttempt": "1",
    "runId": "39951538607",
    "scheduledAt": null
  },
  "files": {
    "forecasts/attempt-20261023-00-ee26c781b6844741928586bd2897bb65-contract.json": {
      "bytes": 42418,
      "sha256": "f030faa3595ccb57bdb6030574b8a74928ca4ebbfb0c3291cf97d50a61f92e2f"
    },
    "forecasts/attempt-20261023-00-ee26c781b6844741928586bd2897bb65-start.json": {
      "bytes": 474,
      "sha256": "2b39e08cdb9598508ac5ea3c05a2f70f6c1b39bdbba8810790a9cdbd8de26f33"
    },
    "forecasts/attempt-20261023-00-ee26c781b6844741928586bd2897bb65.json": {
      "bytes": 3860,
      "sha256": "edfaae13a327112ebd377792c84ac6c2da1e7027d68775e2e32eb06913fdf992"
    },
    "forecasts/attempt-20261023-06-90a2f14fb03c493aaf99b2c7aab39440-contract.json": {
      "bytes": 42254,
      "sha256": "11e0d2bc5235ac56dedcaa9cda916763dbc3bc56c649bcbac4d27e382994449f"
    },
    "forecasts/attempt-20261023-06-90a2f14fb03c493aaf99b2c7aab39440-start.json": {
      "bytes": 474,
      "sha256": "1e94dcc1efa069f697ebeddc2be9d137f66db6936b4c1ccaf2c1a1baa55243ee"
    },
    "forecasts/attempt-20261023-06-90a2f14fb03c493aaf99b2c7aab39440.json": {
      "bytes": 3861,
      "sha256": "1132b184892817acafad60cfb5c4ccec5cef86490cc0b2c286ed84936ed7c584"
    },
    "forecasts/attempt-20261023-12-99b8b6f4c1754878abec32e0ba53d3df-start.json": {
      "bytes": 474,
      "sha256": "ffa523634ba2430c53cdaeafdecccba40fd0f9b04fd86a0216fb64fdba92bc2b"
    },
    "forecasts/attempt-20261023-12-99b8b6f4c1754878abec32e0ba53d3df.json": {
      "bytes": 3486,
      "sha256": "232a31c0ce462f3ac8723fa3052d32b8b6d9f2dd6592591f2dbf8227ca22e149"
    },
    "forecasts/bodies/219e9072632623b964e402bfd2fb10ca3259a9b0b6baf5151251f4cb1d5d0067.bin": {
      "bytes": 125807,
      "sha256": "219e9072632623b964e402bfd2fb10ca3259a9b0b6baf5151251f4cb1d5d0067"
    },
    "forecasts/bodies/5d75b70e8ee54a2fe5da060136feb2be8f91d50dc4b3b5b33c33be2cb2ef5ac2.bin": {
      "bytes": 8833665,
      "sha256": "5d75b70e8ee54a2fe5da060136feb2be8f91d50dc4b3b5b33c33be2cb2ef5ac2"
    },
    "forecasts/records/90a2f14fb03c493aaf99b2c7aab39440-csv-start.json": {
      "bytes": 347,
      "sha256": "e562d4fb122fb9d0b417d25e961210aac3c8e7c391797ed63849e3007c1b286f"
    },
    "forecasts/records/90a2f14fb03c493aaf99b2c7aab39440-csv.json": {
      "bytes": 1551,
      "sha256": "6ddf7e6bf37e0740432611bafea52c91d91921cfceac56535e5564418720c639"
    },
    "forecasts/records/90a2f14fb03c493aaf99b2c7aab39440-shef-start.json": {
      "bytes": 348,
      "sha256": "5e9cac4229683c91c5598c7362bcb4a5d645e6a3709fbc1bc41bd469cce1f2b3"
    },
    "forecasts/records/90a2f14fb03c493aaf99b2c7aab39440-shef.json": {
      "bytes": 1561,
      "sha256": "a0007b2421559889dbd6fb018edeea0d413d4cf619f0211dfe59c7c08eb34923"
    },
    "forecasts/records/99b8b6f4c1754878abec32e0ba53d3df-csv-start.json": {
      "bytes": 347,
      "sha256": "b285444186aa6621eb211e443530fc72304a946520ab0092de05c08b8ca77397"
    },
    "forecasts/records/99b8b6f4c1754878abec32e0ba53d3df-csv.json": {
      "bytes": 1384,
      "sha256": "325fbba05192f2c4e8a169403204bfcaaabed3e03f4a588cbc6a358d0d3434da"
    },
    "forecasts/records/99b8b6f4c1754878abec32e0ba53d3df-shef-start.json": {
      "bytes": 348,
      "sha256": "c6bc24ba635a8b279627d90481319b9f105c07e482b1396506ef52c330922490"
    },
    "forecasts/records/99b8b6f4c1754878abec32e0ba53d3df-shef.json": {
      "bytes": 1385,
      "sha256": "3fa5ab1097f820ff6b543807df2096e5bfa032c47c5febdb44b9ddc3a7ed8c92"
    },
    "forecasts/records/ee26c781b6844741928586bd2897bb65-csv-start.json": {
      "bytes": 347,
      "sha256": "2c64065b2067539b18ea811a0e70551d0c1d405dc000349b7a7a98e5513e21c9"
    },
    "forecasts/records/ee26c781b6844741928586bd2897bb65-csv.json": {
      "bytes": 1550,